B1: 2021家庭预算
D2: 1月 | E2: 2月 | F2: 3月 | G2: 4月 | H2: 5月 | I2: 6月 | J2: 7月 | K2: 8月 | L2: 9月 | M2: 10月 | N2: 11月 | O2: 12月 | P2: 合计
B3: 生活 | C3: 话费 | D3: 60 | E3: =D3 -> 60 | F3: =E3 -> 60 | G3: =F3 -> 60 | H3: =G3 -> 60 | I3: =H3 -> 60 | J3: =I3 -> 60 | K3: =J3 -> 60 | L3: =K3 -> 60 | M3: =L3 -> 60 | N3: =M3 -> 60 | O3: =N3 -> 60 | P3: =SUM(D3:O3) -> 720
C4: 水费 | D4: 20 | E4: =D4 -> 20 | F4: =E4 -> 20 | G4: =F4 -> 20 | H4: =G4 -> 20 | I4: =H4 -> 20 | J4: =I4 -> 20 | K4: =J4 -> 20 | L4: =K4 -> 20 | M4: =L4 -> 20 | N4: =M4 -> 20 | O4: =N4 -> 20 | P4: =SUM(D4:O4) -> 240
C5: 电费 | D5: 50 | E5: =D5 -> 50 | F5: =E5 -> 50 | G5: =F5 -> 50 | H5: =G5 -> 50 | I5: =H5 -> 50 | J5: =I5 -> 50 | K5: =J5 -> 50 | L5: =K5 -> 50 | M5: =L5 -> 50 | N5: =M5 -> 50 | O5: =N5 -> 50 | P5: =SUM(D5:O5) -> 600
C6: 燃气费 | D6: 20 | E6: =D6 -> 20 | F6: =E6 -> 20 | G6: =F6 -> 20 | H6: =G6 -> 20 | I6: =H6 -> 20 | J6: =I6 -> 20 | K6: =J6 -> 20 | L6: =K6 -> 20 | M6: =L6 -> 20 | N6: =M6 -> 20 | O6: =N6 -> 20 | P6: =SUM(D6:O6) -> 240
C7: 党费 | D7: 20 | E7: 0 | F7: 0 | G7: 20 | H7: 0 | I7: 0 | J7: 20 | K7: 0 | L7: 0 | M7: 20 | N7: 0 | O7: 0 | P7: =SUM(D7:O7) -> 80
C8: 其他 | D8: 0 | E8: 0 | F8: 0 | G8: 0 | H8: 0 | I8: 0 | J8: 0 | K8: 0 | L8: 0 | M8: 0 | N8: 0 | O8: 0 | P8: =SUM(D8:O8) -> 0
C9: 其他 | D9: 0 | E9: 0 | F9: 0 | G9: 0 | H9: 0 | I9: 0 | J9: 0 | K9: 0 | L9: 0 | M9: 0 | N9: 0 | O9: 0 | P9: =SUM(D9:O9) -> 0
C10: 合计 | D10: =SUM(D3:D9) -> 170 | E10: =SUM(E3:E9) -> 150 | F10: =SUM(F3:F9) -> 150 | G10: =SUM(G3:G9) -> 170 | H10: =SUM(H3:H9) -> 150 | I10: =SUM(I3:I9) -> 150 | J10: =SUM(J3:J9) -> 170 | K10: =SUM(K3:K9) -> 150 | L10: =SUM(L3:L9) -> 150 | M10: =SUM(M3:M9) -> 170 | N10: =SUM(N3:N9) -> 150 | O10: =SUM(O3:O9) -> 150 | P10: =SUM(D10:O10) -> 1880.
B11: 日常 | C11: 食品 | D11: 2000. | E11: =D11 -> 2000. | F11: =E11 -> 2000. | G11: =F11 -> 2000. | H11: =G11 -> 2000. | I11: =H11 -> 2000. | J11: =I11 -> 2000. | K11: =J11 -> 2000. | L11: =K11 -> 2000. | M11: =L11 -> 2000. | N11: =M11 -> 2000. | O11: =N11 -> 2000. | P11: =SUM(D11:O11) -> 24000.
C12: 家居用品 | D12: 100 | E12: =D12 -> 100 | F12: =E12 -> 100 | G12: =F12 -> 100 | H12: =G12 -> 100 | I12: =H12 -> 100 | J12: =I12 -> 100 | K12: =J12 -> 100 | L12: =K12 -> 100 | M12: =L12 -> 100 | N12: =M12 -> 100 | O12: =N12 -> 100 | P12: =SUM(D12:O12) -> 1200.
C13: 请客 | D13: 0 | E13: =D13 -> 0 | F13: =E13 -> 0 | G13: =F13 -> 0 | H13: =G13 -> 0 | I13: =H13 -> 0 | J13: =I13 -> 0 | K13: =J13 -> 0 | L13: =K13 -> 0 | M13: =L13 -> 0 | N13: =M13 -> 0 | O13: =N13 -> 0 | P13: =SUM(D13:O13) -> 0
C14: 德莱文 | D14: 300 | E14: =D14 -> 300 | F14: =E14 -> 300 | G14: =F14 -> 300 | H14: 300 | I14: 300 | J14: =I14 -> 300 | K14: =J14 -> 300 | L14: =K14 -> 300 | M14: =L14 -> 300 | N14: =M14 -> 300 | O14: =N14 -> 300 | P14: =SUM(D14:O14) -> 3600.
C15: 其他 | D15: 0 | E15: 0 | F15: 0 | G15: 0 | H15: 0 | I15: 0 | J15: 0 | K15: 0 | L15: 0 | M15: 0 | N15: 0 | O15: 0 | P15: =SUM(D15:O15) -> 0
C16: 合计 | D16: =SUM(D11:D15) -> 2400. | E16: =SUM(E11:E15) -> 2400. | F16: =SUM(F11:F15) -> 2400. | G16: =SUM(G11:G15) -> 2400. | H16: =SUM(H11:H15) -> 2400. | I16: =SUM(I11:I15) -> 2400. | J16: =SUM(J11:J15) -> 2400. | K16: =SUM(K11:K15) -> 2400. | L16: =SUM(L11:L15) -> 2400. | M16: =SUM(M11:M15) -> 2400. | N16: =SUM(N11:N15) -> 2400. | O16: =SUM(O11:O15) -> 2400. | P16: =SUM(D16:O16) -> 28800.
B17: 交通 | C17: 汽油费 | D17: 500 | E17: =D17 -> 500 | F17: =E17 -> 500 | G17: =F17 -> 500 | H17: =G17 -> 500 | I17: =H17 -> 500 | J17: =I17 -> 500 | K17: =J17 -> 500 | L17: =K17 -> 500 | M17: =L17 -> 500 | N17: =M17 -> 500 | O17: =N17 -> 500 | P17: =SUM(D17:O17) -> 6000.
C18: 保险费 | D18: 0 | E18: 0 | F18: 0 | G18: 0 | H18: 0 | I18: 0 | J18: 0 | K18: 0 | L18: 0 | M18: 0 | N18: 0 | O18: 0 | P18: =SUM(D18:O18) -> 0
C19: 修理费 | D19: 100 | E19: =D19 -> 100 | F19: =E19 -> 100 | G19: =F19 -> 100 | H19: =G19 -> 100 | I19: =H19 -> 100 | J19: =I19 -> 100 | K19: =J19 -> 100 | L19: =K19 -> 100 | M19: =L19 -> 100 | N19: =M19 -> 100 | O19: =N19 -> 100 | P19: =SUM(D19:O19) -> 1200.
C20: 洗车费 | D20: 20 | E20: =D20 -> 20 | F20: =E20 -> 20 | G20: =F20 -> 20 | H20: =G20 -> 20 | I20: =H20 -> 20 | J20: =I20 -> 20 | K20: =J20 -> 20 | L20: =K20 -> 20 | M20: =L20 -> 20 | N20: =M20 -> 20 | O20: =N20 -> 20 | P20: =SUM(D20:O20) -> 240
C21: 停车位 | D21: 200 | E21: =D21 -> 200 | F21: =E21 -> 200 | G21: =F21 -> 200 | H21: =G21 -> 200 | I21: =H21 -> 200 | J21: =I21 -> 200 | K21: =J21 -> 200 | L21: =K21 -> 200 | M21: =L21 -> 200 | N21: =M21 -> 200 | O21: =N21 -> 200 | P21: =SUM(D21:O21) -> 2400.
C22: 停车费 | D22: 10 | E22: =D22 -> 10 | F22: =E22 -> 10 | G22: =F22 -> 10 | H22: =G22 -> 10 | I22: =H22 -> 10 | J22: =I22 -> 10 | K22: =J22 -> 10 | L22: =K22 -> 10 | M22: =L22 -> 10 | N22: =M22 -> 10 | O22: =N22 -> 10 | P22: =SUM(D22:O22) -> 120
C23: 合计 | D23: =SUM(D17:D22) -> 830 | E23: =SUM(E17:E22) -> 830 | F23: =SUM(F17:F22) -> 830 | G23: =SUM(G17:G22) -> 830 | H23: =SUM(H17:H22) -> 830 | I23: =SUM(I17:I22) -> 830 | J23: =SUM(J17:J22) -> 830 | K23: =SUM(K17:K22) -> 830 | L23: =SUM(L17:L22) -> 830 | M23: =SUM(M17:M22) -> 830 | N23: =SUM(N17:N22) -> 830 | O23: =SUM(O17:O22) -> 830 | P23: =SUM(D23:O23) -> 9960.
B24: 娱乐 | C24: 电影/演出 | D24: 40 | E24: =D24 -> 40 | F24: =E24 -> 40 | G24: =F24 -> 40 | H24: =G24 -> 40 | I24: =H24 -> 40 | J24: =I24 -> 40 | K24: =J24 -> 40 | L24: =K24 -> 40 | M24: =L24 -> 40 | N24: =M24 -> 40 | O24: =N24 -> 40 | P24: =SUM(D24:O24) -> 480
C25: 外出就餐 | D25: 300 | E25: 300 | F25: 300 | G25: 300 | H25: 300 | I25: 300 | J25: 300 | K25: 300 | L25: 300 | M25: 300 | N25: 300 | O25: 300 | P25: =SUM(D25:O25) -> 3600.
C26: 纪念日 | D26: 0 | E26: 500 | F26: 200 | G26: 500 | H26: 0 | I26: 500 | J26: 200 | K26: 0 | L26: 200 | M26: 0 | N26: 0 | O26: 500 | P26: =SUM(D26:O26) -> 2600.
C27: 合计 | D27: =SUM(D24:D26) -> 340 | E27: =SUM(E24:E26) -> 840 | F27: =SUM(F24:F26) -> 540 | G27: =SUM(G24:G26) -> 840 | H27: =SUM(H24:H26) -> 340 | I27: =SUM(I24:I26) -> 840 | J27: =SUM(J24:J26) -> 540 | K27: =SUM(K24:K26) -> 340 | L27: =SUM(L24:L26) -> 540 | M27: =SUM(M24:M26) -> 340 | N27: =SUM(N24:N26) -> 340 | O27: =SUM(O24:O26) -> 840 | P27: =SUM(D27:O27) -> 6680.
B28: 医疗 | C28: 看病吃药 | D28: 200 | E28: =D28 -> 200 | F28: =E28 -> 200 | G28: =F28 -> 200 | H28: =G28 -> 200 | I28: =H28 -> 200 | J28: =I28 -> 200 | K28: =J28 -> 200 | L28: =K28 -> 200 | M28: =L28 -> 200 | N28: =M28 -> 200 | O28: =N28 -> 200 | P28: =SUM(D28:O28) -> 2400.
C29: 德莱文生病 | D29: 100 | E29: =D29 -> 100 | F29: =E29 -> 100 | G29: =F29 -> 100 | H29: =G29 -> 100 | I29: =H29 -> 100 | J29: =I29 -> 100 | K29: =J29 -> 100 | L29: =K29 -> 100 | M29: =L29 -> 100 | N29: =M29 -> 100 | O29: =N29 -> 100 | P29: =SUM(D29:O29) -> 1200.
C30: 其他 | D30: 0 | E30: 0 | F30: 0 | G30: 0 | H30: 0 | I30: 0 | J30: 0 | K30: 0 | L30: 0 | M30: 0 | N30: 0 | O30: 0 | P30: =SUM(D30:O30) -> 0
C31: 其他 | D31: 0 | E31: 0 | F31: 0 | G31: 0 | H31: 0 | I31: 0 | J31: 0 | K31: 0 | L31: 0 | M31: 0 | N31: 0 | O31: 0 | P31: =SUM(D31:O31) -> 0
C32: 其他 | D32: 0 | E32: 0 | F32: 0 | G32: 0 | H32: 0 | I32: 0 | J32: 0 | K32: 0 | L32: 0 | M32: 0 | N32: 0 | O32: 0 | P32: =SUM(D32:O32) -> 0
C33: 合计 | D33: =SUM(D28:D32) -> 300 | E33: =SUM(E28:E32) -> 300 | F33: =SUM(F28:F32) -> 300 | G33: =SUM(G28:G32) -> 300 | H33: =SUM(H28:H32) -> 300 | I33: =SUM(I28:I32) -> 300 | J33: =SUM(J28:J32) -> 300 | K33: =SUM(K28:K32) -> 300 | L33: =SUM(L28:L32) -> 300 | M33: =SUM(M28:M32) -> 300 | N33: =SUM(N28:N32) -> 300 | O33: =SUM(O28:O32) -> 300 | P33: =SUM(D33:O33) -> 3600.
B34: 旅游 | C34: 车船机票 | D34: 0 | E34: 0 | F34: 0 | G34: 0 | H34: 0 | I34: 0 | J34: 600 | K34: 0 | L34: 0 | M34: 0 | N34: 0 | O34: 0 | P34: =SUM(D34:O34) -> 600
C35: 住宿 | D35: 0 | E35: 0 | F35: 0 | G35: 0 | H35: 0 | I35: 0 | J35: 1000. | K35: 0 | L35: 0 | M35: 0 | N35: 0 | O35: 0 | P35: =SUM(D35:O35) -> 1000.
C36: 餐饮 | D36: 0 | E36: 0 | F36: 0 | G36: 0 | H36: 0 | I36: 0 | J36: 800 | K36: 0 | L36: 0 | M36: 0 | N36: 0 | O36: 0 | P36: =SUM(D36:O36) -> 800
C37: 纪念品 | D37: 0 | E37: 0 | F37: 0 | G37: 0 | H37: 0 | I37: 0 | J37: 200 | K37: 0 | L37: 0 | M37: 0 | N37: 0 | O37: 0 | P37: =SUM(D37:O37) -> 200
C38: 摄影 | D38: 0 | E38: 0 | F38: 0 | G38: 0 | H38: 0 | I38: 0 | J38: 0 | K38: 0 | L38: 0 | M38: 0 | N38: 0 | O38: 0 | P38: =SUM(D38:O38) -> 0
C39: 其他 | D39: 0 | E39: 0 | F39: 0 | G39: 0 | H39: 0 | I39: 0 | J39: 0 | K39: 0 | L39: 0 | M39: 0 | N39: 0 | O39: 0 | P39: =SUM(D39:O39) -> 0
C40: 合计 | D40: =SUM(D34:D39) -> 0 | E40: =SUM(E34:E39) -> 0 | F40: =SUM(F34:F39) -> 0 | G40: =SUM(G34:G39) -> 0 | H40: =SUM(H34:H39) -> 0 | I40: =SUM(I34:I39) -> 0 | J40: =SUM(J34:J39) -> 2600. | K40: =SUM(K34:K39) -> 0 | L40: =SUM(L34:L39) -> 0 | M40: =SUM(M34:M39) -> 0 | N40: =SUM(N34:N39) -> 0 | O40: =SUM(O34:O39) -> 0 | P40: =SUM(D40:O40) -> 2600.
B41: 健身 | C41: 健身俱乐部 | D41: 0 | E41: 0 | F41: 0 | G41: 0 | H41: 0 | I41: 0 | J41: 0 | K41: 0 | L41: 0 | M41: 0 | N41: 0 | O41: 0 | P41: =SUM(D41:O41) -> 0
C42: 健身用品 | D42: 100 | E42: =D42 -> 100 | F42: =E42 -> 100 | G42: =F42 -> 100 | H42: =G42 -> 100 | I42: =H42 -> 100 | J42: =I42 -> 100 | K42: =J42 -> 100 | L42: =K42 -> 100 | M42: =L42 -> 100 | N42: =M42 -> 100 | O42: =N42 -> 100 | P42: =SUM(D42:O42) -> 1200.
C43: 运动 | D43: 0 | E43: 0 | F43: 0 | G43: 0 | H43: 0 | I43: 0 | J43: 0 | K43: 0 | L43: 0 | M43: 0 | N43: 0 | O43: 0 | P43: =SUM(D43:O43) -> 0
C44: 其他 | D44: 0 | E44: 0 | F44: 0 | G44: 0 | H44: 0 | I44: 0 | J44: 0 | K44: 0 | L44: 0 | M44: 0 | N44: 0 | O44: 0 | P44: =SUM(D44:O44) -> 0
C45: 合计 | D45: =SUM(D41:D44) -> 100 | E45: =SUM(E41:E44) -> 100 | F45: =SUM(F41:F44) -> 100 | G45: =SUM(G41:G44) -> 100 | H45: =SUM(H41:H44) -> 100 | I45: =SUM(I41:I44) -> 100 | J45: =SUM(J41:J44) -> 100 | K45: =SUM(K41:K44) -> 100 | L45: =SUM(L41:L44) -> 100 | M45: =SUM(M41:M44) -> 100 | N45: =SUM(N41:N44) -> 100 | O45: =SUM(O41:O44) -> 100 | P45: =SUM(D45:O45) -> 1200.
B46: 学习 | C46: 网课 | D46: 100 | E46: 0 | F46: 0 | G46: 0 | H46: 0 | I46: 0 | J46: 0 | K46: 0 | L46: 0 | M46: 0 | N46: 0 | O46: 0 | P46: =SUM(D46:O46) -> 100
C47: 资料 | D47: 300 | E47: 0 | F47: 0 | G47: 0 | H47: 0 | I47: 0 | J47: 300 | K47: 0 | L47: 0 | M47: 0 | N47: 0 | O47: 0 | P47: =SUM(D47:O47) -> 600
C48: 文具 | D48: 200 | E48: 0 | F48: 0 | G48: 0 | H48: 0 | I48: 0 | J48: 0 | K48: 0 | L48: 0 | M48: 0 | N48: 0 | O48: 0 | P48: =SUM(D48:O48) -> 200
C49: A4纸 | D49: 0 | E49: 0 | F49: 0 | G49: 0 | H49: 0 | I49: 0 | J49: 100 | K49: 0 | L49: 0 | M49: 0 | N49: 0 | O49: 0 | P49: =SUM(D49:O49) -> 100
C50: 报名 | D50: 0 | E50: 0 | F50: 0 | G50: 0 | H50: 0 | I50: 0 | J50: 0 | K50: 0 | L50: 0 | M50: 240 | N50: 0 | O50: 0 | P50: =SUM(D50:O50) -> 240
C51: 其他 | D51: 0 | E51: 0 | F51: 0 | G51: 0 | H51: 0 | I51: 0 | J51: 0 | K51: 0 | L51: 0 | M51: 0 | N51: 0 | O51: 0 | P51: =SUM(D51:O51) -> 0
C52: 其他 | D52: 0 | E52: 0 | F52: 0 | G52: 0 | H52: 0 | I52: 0 | J52: 0 | K52: 0 | L52: 0 | M52: 0 | N52: 0 | O52: 0 | P52: =SUM(D52:O52) -> 0
C53: 合计 | D53: =SUM(D46:D52) -> 600 | E53: =SUM(E46:E52) -> 0 | F53: =SUM(F46:F52) -> 0 | G53: =SUM(G46:G52) -> 0 | H53: =SUM(H46:H52) -> 0 | I53: =SUM(I46:I52) -> 0 | J53: =SUM(J46:J52) -> 400 | K53: =SUM(K46:K52) -> 0 | L53: =SUM(L46:L52) -> 0 | M53: =SUM(M46:M52) -> 240 | N53: =SUM(N46:N52) -> 0 | O53: =SUM(O46:O52) -> 0 | P53: =SUM(D53:O53) -> 1240.
B54: 大王凯 | C54: 衣物 | D54: 500 | E54: 0 | F54: 0 | G54: 0 | H54: 0 | I54: 500 | J54: 0 | K54: 0 | L54: 0 | M54: 0 | N54: 500 | O54: 0 | P54: =SUM(D54:O54) -> 1500.
C55: 美容美发 | D55: 80 | E55: =D55 -> 80 | F55: =E55 -> 80 | G55: =F55 -> 80 | H55: =G55 -> 80 | I55: =H55 -> 80 | J55: =I55 -> 80 | K55: =J55 -> 80 | L55: =K55 -> 80 | M55: =L55 -> 80 | N55: =M55 -> 80 | O55: =N55 -> 80 | P55: =SUM(D55:O55) -> 960
C56: 零花钱 | D56: 200 | E56: =D56 -> 200 | F56: =E56 -> 200 | G56: =F56 -> 200 | H56: =G56 -> 200 | I56: =H56 -> 200 | J56: =I56 -> 200 | K56: =J56 -> 200 | L56: =K56 -> 200 | M56: =L56 -> 200 | N56: =M56 -> 200 | O56: =N56 -> 200 | P56: =SUM(D56:O56) -> 2400.
C57: 其他 | D57: 0 | E57: 0 | F57: 0 | G57: 0 | H57: 0 | I57: 0 | J57: 0 | K57: 0 | L57: 0 | M57: 0 | N57: 0 | O57: 0 | P57: =SUM(D57:O57) -> 0
C58: 其他 | D58: 0 | E58: 0 | F58: 0 | G58: 0 | H58: 0 | I58: 0 | J58: 0 | K58: 0 | L58: 0 | M58: 0 | N58: 0 | O58: 0 | P58: =SUM(D58:O58) -> 0
C59: 合计 | D59: =SUM(D54:D58) -> 780 | E59: =SUM(E54:E58) -> 280 | F59: =SUM(F54:F58) -> 280 | G59: =SUM(G54:G58) -> 280 | H59: =SUM(H54:H58) -> 280 | I59: =SUM(I54:I58) -> 780 | J59: =SUM(J54:J58) -> 280 | K59: =SUM(K54:K58) -> 280 | L59: =SUM(L54:L58) -> 280 | M59: =SUM(M54:M58) -> 280 | N59: =SUM(N54:N58) -> 780 | O59: =SUM(O54:O58) -> 280 | P59: =SUM(P54:P58) -> 4860.
B60: 小仙女 | C60: 衣物 | D60: 500 | E60: 0 | F60: 0 | G60: 0 | H60: 0 | I60: 500 | J60: 0 | K60: 0 | L60: 0 | M60: 0 | N60: 500 | O60: 0 | P60: =SUM(D60:O60) -> 1500.
C61: 护肤 | D61: 3000. | E61: 0 | F61: 0 | G61: 0 | H61: 0 | I61: 0 | J61: 3000. | K61: 0 | L61: 0 | M61: =L61 -> 0 | N61: 0 | O61: 0 | P61: =SUM(D61:O61) -> 6000.
C62: 零花钱 | D62: 0 | E62: =D62 -> 0 | F62: =E62 -> 0 | G62: =F62 -> 0 | H62: =G62 -> 0 | I62: =H62 -> 0 | J62: =I62 -> 0 | K62: =J62 -> 0 | L62: =K62 -> 0 | M62: =L62 -> 0 | N62: =M62 -> 0 | O62: =N62 -> 0 | P62: =SUM(D62:O62) -> 0
C63: 其他 | D63: 0 | E63: 0 | F63: 0 | G63: 0 | H63: =G63 -> 0 | I63: 0 | J63: 0 | K63: 0 | L63: 0 | M63: =L63 -> 0 | N63: 0 | O63: 0 | P63: =SUM(D63:O63) -> 0
C64: 其他 | D64: 0 | E64: 0 | F64: 0 | G64: 0 | H64: 0 | I64: 0 | J64: 0 | K64: 0 | L64: 0 | M64: 0 | N64: 0 | O64: 0 | P64: =SUM(D64:O64) -> 0
C65: 合计 | D65: =SUM(D60:D64) -> 3500. | E65: =SUM(E60:E64) -> 0 | F65: =SUM(F60:F64) -> 0 | G65: =SUM(G60:G64) -> 0 | H65: =SUM(H60:H64) -> 0 | I65: =SUM(I60:I64) -> 500 | J65: =SUM(J60:J64) -> 3000. | K65: =SUM(K60:K64) -> 0 | L65: =SUM(L60:L64) -> 0 | M65: =SUM(M60:M64) -> 0 | N65: =SUM(N60:N64) -> 500 | O65: =SUM(O60:O64) -> 0 | P65: =SUM(P60:P64) -> 7500.
B66: 理财 | C66: 定期存款 | D66: 500 | E66: =D66 -> 500 | F66: =E66 -> 500 | G66: =F66 -> 500 | H66: =G66 -> 500 | I66: =H66 -> 500 | J66: =I66 -> 500 | K66: =J66 -> 500 | L66: =K66 -> 500 | M66: =L66 -> 500 | N66: =M66 -> 500 | O66: =N66 -> 500 | P66: =SUM(D66:O66) -> 6000.
C67: 活期存款 | D67: 0 | E67: 0 | F67: 0 | G67: 0 | H67: 0 | I67: 0 | J67: 0 | K67: 0 | L67: 0 | M67: 0 | N67: 0 | O67: 0 | P67: =SUM(D67:O67) -> 0
C68: 支付信用卡 | D68: 0 | E68: 0 | F68: 0 | G68: 0 | H68: 0 | I68: 0 | J68: 0 | K68: 0 | L68: 0 | M68: 0 | N68: 0 | O68: 0 | P68: =SUM(D68:O68) -> 0
C69: 其他 | D69: 0 | E69: 0 | F69: 0 | G69: 0 | H69: 0 | I69: 0 | J69: 0 | K69: 0 | L69: 0 | M69: 0 | N69: 0 | O69: 0 | P69: =SUM(D69:O69) -> 0
C70: 合计 | D70: =SUM(D66:D69) -> 500 | E70: =SUM(E66:E69) -> 500 | F70: =SUM(F66:F69) -> 500 | G70: =SUM(G66:G69) -> 500 | H70: =SUM(H66:H69) -> 500 | I70: =SUM(I66:I69) -> 500 | J70: =SUM(J66:J69) -> 500 | K70: =SUM(K66:K69) -> 500 | L70: =SUM(L66:L69) -> 500 | M70: =SUM(M66:M69) -> 500 | N70: =SUM(N66:N69) -> 500 | O70: =SUM(O66:O69) -> 500 | P70: =SUM(P66:P69) -> 6000.
B71: 其他 | C71: 其他 | D71: 0 | E71: 0 | F71: 0 | G71: 0 | H71: 0 | I71: 0 | J71: 0 | K71: 0 | L71: 0 | M71: 0 | N71: 0 | O71: 0 | P71: =SUM(D71:O71) -> 0
C72: 其他 | D72: 0 | E72: 0 | F72: 0 | G72: 0 | H72: 0 | I72: 0 | J72: 0 | K72: 0 | L72: 0 | M72: 0 | N72: 0 | O72: 0 | P72: =SUM(D72:O72) -> 0
C73: 其他 | D73: 0 | E73: 0 | F73: 0 | G73: 0 | H73: 0 | I73: 0 | J73: 0 | K73: 0 | L73: 0 | M73: 0 | N73: 0 | O73: 0 | P73: =SUM(D73:O73) -> 0
C74: 其他 | D74: 0 | E74: 0 | F74: 0 | G74: 0 | H74: 0 | I74: 0 | J74: 0 | K74: 0 | L74: 0 | M74: 0 | N74: 0 | O74: 0 | P74: =SUM(D74:O74) -> 0
C75: 其他 | D75: 0 | E75: 0 | F75: 0 | G75: 0 | H75: 0 | I75: 0 | J75: 0 | K75: 0 | L75: 0 | M75: 0 | N75: 0 | O75: 0 | P75: =SUM(D75:O75) -> 0
C76: 合计 | D76: =SUM(D71:D75) -> 0 | E76: =SUM(E71:E75) -> 0 | F76: =SUM(F71:F75) -> 0 | G76: =SUM(G71:G75) -> 0 | H76: =SUM(H71:H75) -> 0 | I76: =SUM(I71:I75) -> 0 | J76: =SUM(J71:J75) -> 0 | K76: =SUM(K71:K75) -> 0 | L76: =SUM(L71:L75) -> 0 | M76: =SUM(M71:M75) -> 0 | N76: =SUM(N71:N75) -> 0 | O76: =SUM(O71:O75) -> 0 | P76: =SUM(P71:P75) -> 0
C79: 月份 | D79: 1月 | E79: 2月 | F79: 3月 | G79: 4月 | H79: 5月 | I79: 6月 | J79: 7月 | K79: 8月 | L79: 9月 | M79: 10月 | N79: 11月 | O79: 12月 | P79: 合计
C80: 总支出 | D80: =D10+D16+D23+D27+D33+D40+D45+D53+D59+D70+D76+D65 -> 9520 | E80: =E76+E70+E59+E53+E45+E40+E33+E27+E23+E16+E10+E65 -> 5400 | F80: =F76+F70+F59+F53+F45+F40+F33+F27+F23+F16+F10+F65 -> 5100 | G80: =G76+G70+G59+G53+G45+G40+G33+G27+G23+G16+G10+G65 -> 5420 | H80: =H76+H70+H65+H59+H53+H45+H40+H33+H27+H23+H16+H10 -> 4900 | I80: =I76+I70+I65+I59+I53+I45+I40+I33+I27+I23+I16+I10 -> 6400 | J80: =J76+J70+J65+J59+J53+J45+J40+J33+J27+J23+J16+J10 -> 11120 | K80: =K76+K70+K65+K59+K53+K45+K40+K33+K27+K23+K16+K10 -> 4900 | L80: =L76+L70+L65+L59+L53+L45+L40+L33+L27+L23+L16+L10 -> 5100 | M80: =M76+M70+M65+M59+M53+M45+M40+M33+M27+M23+M16+M10 -> 5160 | N80: =N76+N70+N65+N59+N53+N45+N40+N33+N27+N23+N16+N10 -> 5900 | O80: =O76+O70+O65+O59+O53+O45+O40+O33+O27+O23+O16+O10 -> 5400 | P80: =SUM(D80:O80) -> 74320